{
  "version": "1.0",
  "event": {
    "eventId": "evt-contract-001",
    "tenantId": "factory-01",
    "eventType": "telemetry.reading",
    "timestamp": "2026-10-24T12:00:00Z",
    "source": "sensor-gateway",
    "version": "1.0",
    "payload": {
      "deviceId": "sensor-1042",
      "deviceType": "temperature-sensor",
      "metric": "temperature",
      "value": 28.4,
      "unit": "C",
      "location": "zone-a"
    }
  },
  "errorMessage": "IllegalStateException: failed \"send\"\nretry",
  "sourceService": "ingestion-service",
  "failedAt": "2026-10-24T12:00:02Z"
}
